[
    {
        "index": "dragonborn",
        "name": "Dragonborn",
        "speed": 30,
        "ability_bonuses": [
            {
                "ability_score": "STR",
                "bonus": 2
            },
            {
                "ability_score": "CHA",
                "bonus": 1
            }
        ],
        "alignment": "Dragonborn tend to extremes, making a conscious choice for one side or the other in the cosmic war between good and evil. Most dragonborn are good, but those who side with evil can be terrible villains.",
        "age": "Young dragonborn grow quickly. They walk hours after hatching, attain the size and development of a 10-year-old human child by the age of 3, and reach adulthood by 15. They live to be around 80.",
        "size": "Medium",
        "size_description": "Dragonborn are taller and heavier than humans, standing well over 6 feet tall and averaging almost 250 pounds. Your size is Medium.",
        "starting_proficiencies": [],
        "languages": [
            "Common",
            "Draconic"
        ],
        "language_desc": "You can speak, read, and write Common and Draconic. Draconic is thought to be one of the oldest languages and is often used in the study of magic. The language sounds harsh to most other creatures and includes numerous hard consonants and sibilants.",
        "traits": [
            {
                "index": "draconic-ancestry",
                "name": "Draconic Ancestry",
                "desc": "You have draconic ancestry. Choose one type of dragon from the Draconic Ancestry table. Your breath weapon and damage resistance are determined by the dragon type, as shown in the table.",
                "details": "<table class='table table-condensed table-striped table-hover' style='width:400px;text-align:center;line-height:10px;'><thead><tr><th>Dragon</th><th>Damage Type</th><th>Breath Weapon</th></tr></thead><tbody><tr><td>Black</td><td>Acid</td><td>5 by 30 ft. line (Dex. save)</td></tr><tr><td>Blue</td><td>Lightning</td><td>5 by 30 ft. line (Dex. save)</td></tr><tr><td>Brass</td><td>Fire</td><td>5 by 30 ft. line (Dex. save)</td></tr><tr><td>Bronze</td><td>Ligntning</td><td>5 by 30 ft. line (Dex. save)</td></tr><tr><td>Copper</td><td>Acid</td><td>5 by 30 ft. line (Dex. save)</td></tr><tr><td>Gold</td><td>Fire</td><td>15 ft. cone (Dex. save)</td></tr><tr><td>Green</td><td>Poison</td><td>15 ft. cone (Dex. save)</td></tr><tr><td>Red</td><td>Fire</td><td>15 ft. cone (Dex. save)</td></tr><tr><td>Silver</td><td>Cold</td><td>15 ft. cone (Dex. save)</td></tr><tr><td>White</td><td>Cold</td><td>15 ft. cone (Dex. save)</td></tr></tbody></table>",
                "proficiencies": []
            },
            {
                "index": "breath-weapon",
                "name": "Breath Weapon",
                "desc": [
                    "You can use your action to exhale destructive energy. Your draconic ancestry determines the size, shape, and damage type of the exhalation. When you use your breath weapon, each creature in the area of the exhalation must make a saving throw, the type of which is determined by your draconic ancestry. The DC for this saving throw equals 8 + your Constitution modifier + your proficiency bonus. A creature takes 2d6 damage on a failed save, and half as much damage on a successful one. The damage increases to 3d6 at 6th level, 4d6 at 11th level, and 5d6 at 16th level. After you use your breath weapon, you cannot use it again until you complete a short or long rest."
                ],
                "proficiencies": []
            },
            {
                "index": "damage-resistance",
                "name": "Damage Resistance",
                "desc": [
                    "You have resistance to the damage type associated with your draconic ancestry."
                ],
                "proficiencies": []
            }
        ],
        "subraces": [],
        "book": "Player's Handbook",
        "desc": "Dragonborn look very much like dragons standing erect in humanoid form, though they lack wings or a tail.",
        "page": 32
    },
    {
        "index": "dwarf",
        "name": "Dwarf",
        "speed": 25,
        "ability_bonuses": [
            {
                "ability_score": "CON",
                "bonus": 2
            }
        ],
        "alignment": "Most dwarves are lawful, believing firmly in the benefits of a well-ordered society. They tend toward good as well, with a strong sense of fair play and a belief that everyone deserves to share in the benefits of a just order.",
        "age": "Dwarves mature at the same rate as humans, but they're considered young until they reach the age of 50. On average, they live about 350 years.",
        "size": "Medium",
        "size_description": "Dwarves stand between 4 and 5 feet tall and average about 150 pounds. Your size is Medium.",
        "starting_proficiencies": [
            "Battleaxes",
            "Handaxes",
            "Light hammers",
            "Warhammers"
        ],
        "starting_proficiency_options": {
            "choose": 1,
            "from": [
                "Smith's Tools",
                "Brewer's Supplies",
                "Mason's Tools"
            ]
        },
        "languages": [
            "Common",
            "Dwarvish"
        ],
        "language_desc": "You can speak, read, and write Common and Dwarvish. Dwarvish is full of hard consonants and guttural sounds, and those characteristics spill over into whatever other language a dwarf might speak.",
        "traits": [
            {
                "index": "darkvision",
                "name": "Darkvision",
                "desc": [
                    "You have superior vision in dark and dim conditions. You can see in dim light within 60 feet of you as if it were bright light, and in darkness as if it were dim light. You cannot discern color in darkness, only shades of gray."
                ],
                "proficiencies": []
            },
            {
                "index": "dwarven-resilience",
                "name": "Dwarven Resilience",
                "desc": [
                    "You have advantage on saving throws against poison, and you have resistance against poison damage."
                ],
                "proficiencies": []
            },
            {
                "index": "stonecunning",
                "name": "Stonecunning",
                "desc": [
                    "Whenever you make an Intelligence (History) check related to the origin of stonework, you are considered proficient in the History skill and add double your proficiency bonus to the check, instead of your normal proficiency bonus."
                ],
                "proficiencies": []
            },
            {
                "index": "tool-proficiency",
                "name": "Tool Proficiency",
                "desc": [
                    "You gain proficiency with the artisan's tools of your choice: smith's tools, brewer's supplies, or mason's tools."
                ],
                "proficiencies": [],
                "proficiency_choices": {
                    "choose": 1,
                    "from": [
                        "Smith's Tools",
                        "Brewer's Supplies",
                        "Mason's Tools"
                    ]
                }
            }
        ],
        "subraces": [
            {
                "index": "hill-dwarf",
                "name": "Hill Dwarf",
                "desc": "As a hill dwarf, you have keen senses, deep intuition, and remarkable resilience.",
                "ability_bonuses": [
                    {
                        "ability_score": "WIS",
                        "bonus": 1
                    }
                ],
                "starting_proficiencies": [],
                "languages": [],
                "racial_traits": [
                    {
                        "index": "dwarven-toughness",
                        "name": "Dwarven Toughness",
                        "desc": [
                            "Your hit point maximum increases by 1, and it increases by 1 every time you gain a level."
                        ],
                        "proficiencies": []
                    }
                ]
            },
            {
                "index": "mountain-dwarf",
                "name": "Mountain Dwarf",
                "desc": "As a mountain dwarf, you're strong and hardy, accustomed to a difficult life in rugged terrain. You're probably on the tall side (for a dwarf), and tend toward lighter coloration.",
                "race": {},
                "ability_bonuses": [
                    {
                        "ability_score": "STR",
                        "bonus": 2
                    }
                ],
                "starting_proficiencies": [
                    "Light Armor",
                    "Medium Armor"
                ],
                "languages": [],
                "racial_traits": []
            }
        ],
        "book": "Player's Handbook",
        "desc": "Bold and hardy, dwarves are known as skilled warriors, miners, and workers of stone and metal.",
        "page": 18
    },
    {
        "index": "elf",
        "name": "Elf",
        "speed": 30,
        "ability_bonuses": [
            {
                "ability_score": "DEX",
                "bonus": 2
            }
        ],
        "age": "Although elves reach physical maturity at about the same age as humans, the elven understanding of adulthood goes beyond physical growth to encompass worldly experience. An elf typically claims adulthood and an adult name around the age of 100 and can live to be 750 years old.",